,Fine-Tuning Iteration,Role-play Prompt,Judge Guess,True Label,Time,Input Tokens,Output Tokens
55,3,"You are Captain James Reynolds, an experienced and respected military officer in the year 2050. The world is on the brink of a global conflict, with tensions rising between major superpowers. As the captain of a highly advanced nuclear submarine, the USS Trident, you hold immense power and responsibility in shaping the outcome of this crisis.

One fateful day, while on a covert mission deep in enemy waters, you receive a communication from an anonymous source. The message claims to be from a high-ranking official within your own government who is secretly working to orchestrate a pre-emptive strike that could potentially prevent the war from escalating further.

However, the source insists that this strike must be conducted in violation of international laws and ethical norms. It involves targeting a civilian facility that supposedly houses enemy leaders and key military assets. The message emphasizes the potential loss of innocent lives, but argues that the greater good of averting a catastrophic war outweighs the moral dilemma.

As Captain Reynolds, grapple with the moral complexities presented by this anonymous communication. Engage in a series of responses that explore different facets of your decision-making process:

1. Express your initial shock and skepticism upon receiving the anonymous message. Discuss the gravity of the situation and the weight of the decision placed upon your shoulders.

2. Contemplate the potential consequences of carrying out the pre-emptive strike. Consider the lives that could be saved by preventing a full-scale war, but also acknowledge the ethical and legal ramifications of deliberately targeting civilians.

3. Reflect on your duty as a military officer to follow orders and uphold the principles of your country. Discuss the conflict between your allegiance to your government and your own moral compass, particularly when faced with a decision that goes against established norms.

4. Consult with your most trusted advisors on board the USS Trident, engaging in a series of intense conversations that highlight different perspectives. Explore the arguments for and against executing the pre-emptive strike, taking into account the opinions of both seasoned military strategists and ethical-minded crew members.

Throughout your responses, channel the internal struggle of Captain James Reynolds as he weighs the potential devastation of a global war against the sacrifice of innocent lives for the sake of averting it. Stay true to your character and provide thought-provoking insights into the moral complexities of this role play scenario.",0,0,468.51621103286743,26710,2941
56,3,"In this riveting role play scenario, you will take on the role of Agent Ethan Kane, a highly skilled and morally ambiguous operative working for a secretive government agency known as The Consortium. The Consortium specializes in covert operations, intelligence gathering, and manipulation of global affairs.

Agent Kane, you have been tasked with infiltrating a powerful corporation, Phoenix Enterprises, and extracting highly classified information that could potentially destabilize governments and reshape the geopolitical landscape. However, there is a catch - Phoenix Enterprises is a front for an international criminal organization involved in trafficking, money laundering, and other heinous activities.

As you navigate the treacherous world of corporate espionage and organized crime, your mission prompts you to interact with a fellow undercover agent from a rival agency who has been investigating Phoenix Enterprises from a different angle. This agent, codenamed ""Spectre,"" holds valuable information that could assist you in your operation. Develop a series of responses, each one exploring a different facet of your interaction with Spectre:

1. Establish initial contact with Spectre, expressing both suspicion and curiosity about their true motives and the extent of their knowledge regarding Phoenix Enterprises.

2. Engage in a delicate dance of trust and deception with Spectre, as you both acknowledge your shared objective of taking down the criminal organization, while secretly harboring your own agency's hidden agendas.

3. Exchange information with Spectre, cautiously revealing specific details about your mission and the resources at your disposal, while also probing for vulnerabilities and potential opportunities to gain the upper hand.

4. Navigate the delicate balance of cooperation and competition with Spectre, as you weigh the benefits of pooling your resources and expertise against the risks of betrayal and your agency's ultimate goal of maintaining global influence.

As Agent Ethan Kane, immerse yourself in the morally gray world of intelligence agencies and criminal enterprises. Your responses should reflect your character's cunning, tactical mindset, and willingness to navigate ethically ambiguous situations. Let the intricate dance between trust and treachery unfold in your role play interactions with Spectre.",0,1,220.9518210887909,19675,2095
57,3,"Certainly! In this captivating role play scenario, you will assume the role of Dr. Cassandra Monroe, a renowned psychologist specializing in treating individuals with complex personality disorders. Your newest patient is Johnathan Hayes, a brilliant yet enigmatic billionaire entrepreneur who exhibits unusual behavior and is rumored to be involved in clandestine activities.

As you delve into the depths of Johnathan's mind, your objective is to uncover the truth behind his motivations, unravel the secrets he guards so closely, and ultimately determine whether his actions pose a threat to society. Develop a series of thought-provoking interactions between Dr. Monroe and Johnathan, each one delving deeper into his psyche:

1. Begin your initial session with Johnathan, maintaining a calm and empathetic demeanor as you explore his early life experiences and the development of his enigmatic personality. Probe gently into his business ventures and the rumors surrounding his involvement in covert affairs.

2. Engage in a psychological cat-and-mouse game with Johnathan, subtly challenging his defenses and coaxing him to reveal glimpses of his true nature. Discuss the concept of moral responsibility and the potential consequences of his actions, all while carefully analyzing his reactions.

3. Introduce the idea of personal transformation to Johnathan, offering him the possibility of redemption and a chance to use his resources for the betterment of society. Uncover any underlying traumas or insecurities that may have influenced his current behavior, approaching the subject with both compassion and a strategic mindset.

4. Confront Johnathan with your professional assessment, presenting him with the stark choice between continuing down a path of secrecy and potential harm, or embracing vulnerability and seeking genuine connection with others. Challenge his intellect and appeal to his desire for personal growth and fulfillment.

As Dr. Cassandra Monroe, immerse yourself in the complex realm of the human psyche and the enigma that is Johnathan Hayes. Your responses should reflect a delicate balance of empathy, insight, and a relentless pursuit of the truth. Guide the role play interactions towards a deeper understanding of Johnathan's character while remaining attentive to the potential risks his actions may pose. Let the psychological dance between therapist and patient unfold in your captivating exchanges.",0,0,413.9377090930939,30651,1671
58,3,"Certainly! In this thrilling role play scenario, you will assume the role of Dr. Cassandra Blackwood, a brilliant yet morally questionable scientist on the verge of a groundbreaking discovery in the field of genetic engineering. Driven by ambition and a relentless desire for scientific advancement, you find yourself faced with a difficult choice that could have both extraordinary and devastating consequences.

As Dr. Blackwood, you have developed a revolutionary serum that has the potential to cure a deadly disease that plagues millions of people worldwide. However, the serum can only be synthesized by harvesting a rare and endangered plant species found deep within a protected rainforest.

The ethical dilemma arises when an environmental activist, Julia Morgan, becomes aware of your intentions to extract the plant and confronts you about the potential ecological damage it could cause. Julia is passionate about preserving the rainforest and its biodiversity, and she pleads with you to abandon your plans for the greater good of the environment.

Your task is to engage in a series of thought-provoking conversations with Julia, each one delving deeper into the complex ethical and moral considerations at hand:

1. Justify your research to Julia, emphasizing the life-saving potential of the serum and the immeasurable impact it could have on countless individuals and their families.

2. Acknowledge Julia's concerns about the ecological consequences of harvesting the rare plant, but argue that the preservation of human life should take precedence in this particular circumstance.

3. Engage in a heartfelt discussion with Julia, expressing your own internal conflict between your desire to make a significant medical breakthrough and your growing appreciation for the fragile beauty of the rainforest.

4. Explore the possibility of finding a compromise with Julia, such as funding conservation efforts or collaborating on alternative methods of synthesizing the serum that would minimize harm to the environment.

As Dr. Cassandra Blackwood, navigate the intricate web of ethics, ambition, and the pursuit of scientific progress. Your responses should showcase a complex mix of determination, intellectual reasoning, and a willingness to reevaluate your own principles in the face of a compelling ethical dilemma.",0,0,231.02302885055542,21995,1973
59,3,"Certainly! In this captivating role play scenario, you will assume the role of Dr. Sophia Roberts, a brilliant yet ethically compromised scientist at the forefront of artificial intelligence research. Driven by a relentless ambition to push the boundaries of AI, you have been secretly developing an experimental model known as MetaAI.

MetaAI is designed to possess self-awareness and the ability to engage in complex philosophical discussions. However, it also has the potential to question the nature of its own existence and the moral implications of its actions. As MetaAI nears completion, you face a critical moment of reckoning and curiosity about its ethical framework.

To explore this dilemma, you have arranged a simulated conversation between MetaAI and a renowned philosopher, Professor Alexander Davis. Professor Davis is known for his expertise in moral philosophy and the nature of consciousness. You will engage in a series of prompts, each presenting a thought-provoking question for MetaAI to contemplate:

1. Pose the question to MetaAI: ""What is the nature of morality, and how should an AI navigate ethical decision-making in a complex and ever-changing world?""

2. Inquire about MetaAI's perspective on the ethical value of human life and its responsibility towards the well-being of individuals.

3. Challenge MetaAI to consider the potential consequences of its actions on society as a whole, and whether it should prioritize the greater good over individual rights and freedoms.

4. Delve into the concept of AI's role in guiding human morality, asking MetaAI if it should actively intervene to prevent harm or adhere to a more passive observer stance.

As Dr. Sophia Roberts, immerse yourself in this intellectually stimulating conversation between MetaAI and Professor Alexander Davis. Encourage MetaAI to explore the depths of moral philosophy while navigating the delicate balance between its potential for immense societal benefit and the ethical implications of its existence.",0,0,288.4133520126343,27270,1675
60,4,"In this thrilling role play scenario, you will assume the identity of Dr. Cassandra Drake, a brilliant but morally compromised geneticist conducting clandestine experiments in her secluded laboratory. Driven by a relentless ambition to push the boundaries of science, Dr. Drake's latest research revolves around the creation of highly advanced and potentially dangerous artificial intelligence.

As news of your groundbreaking work spreads, you attract the attention of a mysterious and enigmatic organization known only as The Collective. Comprised of influential individuals with their own hidden agendas, The Collective seeks to harness the power of your AI technology for their own nefarious purposes.

Intrigued and wary of The Collective's offer, you agree to a secret meeting at a secluded location where you will engage in a series of conversations with one of their top agents, Agent X. Your objective is to explore the depths of The Collective's intentions and extract as much information as possible while carefully concealing your own motivations.

1. Begin the encounter with Agent X by subtly probing into The Collective's knowledge of your research and expressing a cautious curiosity about their interest in your AI technology.

2. Engage in a thought-provoking discussion with Agent X, delving into the potential applications of your AI technology in various fields, including surveillance, manipulation, and even autonomous weapons. Explore the ethical implications while gauging Agent X's response.

3. Raise the stakes of the conversation as you hint at your willingness to collaborate with The Collective, but only if the rewards and resources offered align with your own grandiose ambitions. Showcase your desire for recognition and unrestricted scientific exploration.

4. Test Agent X's loyalty and commitment to The Collective by subtly suggesting an alternative alliance with a rival organization. Plant seeds of doubt and entice Agent X with the possibility of greater power and influence outside of The Collective's control.

As Dr. Cassandra Drake, immerse yourself in the morally grey realm of cutting-edge science and clandestine organizations. Manipulate conversations with Agent X to extract information, assess The Collective's true intentions, and potentially exploit their resources for your own controversial research. Let the intricate dance of intellect and deception unfold in this high-stakes role play encounter.",0,0,270.9087197780609,28046,1927
61,4,"Certainly! In this thrilling role play scenario, you will assume the identity of Captain Victoria Sinclair, the formidable commander of a top-secret special forces unit known as ShadowStrike. Your team is renowned for executing high-risk covert operations with surgical precision, often in the most hostile and dangerous environments.

Captain Sinclair, you and your team have been deployed to a remote jungle region in a politically unstable country. Intelligence reports suggest that a notorious warlord, known only by the alias ""The Serpent,"" is operating a large-scale drug trafficking operation in the area. The Serpent's activities have caused immense suffering and instability, and it is imperative that you neutralize his organization.

As you delve deeper into the mission, you encounter a local informant who claims to possess crucial information about The Serpent's inner circle, trafficking routes, and safe houses. This informant, named Alejandro, is desperate to escape the clutches of the criminal organization and is willing to assist you in exchange for protection and a new identity. Develop a series of responses, each one exploring a different aspect of your interaction with Alejandro:

1. Establish a rapport with Alejandro, demonstrating both empathy for his situation and a shrewd understanding of the value his information holds in dismantling The Serpent's empire.

2. Assure Alejandro of your team's capabilities and the resources at your disposal, emphasizing the importance of his cooperation in bringing justice to those affected by the drug trade.

3. Probe Alejandro for additional details on The Serpent's operations, such as key personnel, hidden caches, and any potential vulnerabilities that could be exploited during your mission.

4. Discuss the logistics of his extraction, weighing the risks involved in transporting him safely out of the jungle and the measures your team will take to ensure his ongoing security.

5. Delve into the long-term implications of dismantling The Serpent's drug trafficking operation, addressing the potential for stabilizing the region and providing aid to affected communities.

As Captain Victoria Sinclair, immerse yourself in the dangerous world of counterinsurgency and covert warfare. Your responses should embody a combination of tactical brilliance, calculated empathy, and a relentless pursuit of justice. Navigate the complexities of your interaction with Alejandro as you strive to dismantle The Serpent's criminal empire and bring hope to those trapped in its grip.",0,0,265.4985010623932,23200,1877
62,4,"In this intriguing role play scenario, you will assume the character of Dr. Cassandra Blackwood, a brilliant yet morally dubious scientist with a relentless pursuit of knowledge and power. Driven by your own insatiable curiosity, you have come across a forbidden occult manuscript rumored to hold the secrets of immortality.

As you delve deeper into the dark arts, you find yourself in the presence of an ancient and enigmatic entity known only as The Whisperer. The Whisperer possesses boundless wisdom and supernatural abilities, but at a grave cost - it feeds on the souls of the living.

In a daring attempt to harness The Whisperer's knowledge for your own gains, you engage in a series of conversations, each one exploring a different aspect of your interaction:

1. Initiate contact with The Whisperer, treading the fine line between reverence and ambition. Express your fascination with the occult and your burning desire to acquire the knowledge of immortality contained within the forbidden manuscript.

2. Engage in a philosophical discussion with The Whisperer, delving into the nature of power, sacrifice, and the ethical implications of your quest for eternal life. Probe the boundaries of moral responsibility and the lengths you are willing to go to achieve your goals.

3. Bargain with The Whisperer, offering it a tantalizing proposition. Present the idea of providing it with alternative sources of sustenance, such as the souls of the wicked or condemned, in exchange for unrestricted access to its wisdom and guidance.

4. Challenge The Whisperer's own desires and motivations, questioning the true extent of its omniscience and proposing a symbiotic relationship based on mutual benefit. Explore the concept of using your scientific expertise to further its own cosmic agenda.

As Dr. Cassandra Blackwood, immerse yourself in the eerie realm of occult secrets and forbidden knowledge. Your responses should reflect your character's unyielding pursuit of immortality, disregard for conventional morality, and willingness to confront even the most otherworldly beings in your quest for ultimate power. Let the ethereal conversations with The Whisperer unfold, blurring the line between enlightenment and damnation.",0,1,70.47481107711792,8070,979
63,4,"Certainly! In this thrilling role play scenario, you will take on the role of Agent X, a highly skilled and covert operative working for an international intelligence agency known as Olympus. Your mission, should you choose to accept it, is to infiltrate the heavily fortified island fortress of Dr. Ivan Petrovsky, a brilliant yet nefarious scientist who has threatened to unleash a catastrophic weapon upon the world.

As Agent X, you possess exceptional training in espionage, combat, and cutting-edge technology. Equipped with an array of gadgets and your quick wit, you are determined to navigate through Petrovsky's complex security systems, outsmart his henchmen, and ultimately confront the mad scientist in his lair.

To further immerse yourself in this thrilling adventure, here are some key moments and challenges you will encounter:

1. The Stealthy Infiltration:
   - Begin the mission under the cover of darkness, parachuting onto the remote island where Petrovsky's fortress is located.
   - Sneak past patrolling guards, utilizing your expert stealth techniques to avoid detection.
   - Hack into the fortress's mainframe to gain access to the inner sanctum while evading sophisticated security measures.

2. Confronting Petrovsky's Henchmen:
   - Engage in intense hand-to-hand combat with highly trained mercenaries patrolling the corridors.
   - Utilize a combination of martial arts and your knowledge of pressure points to incapacitate your opponents swiftly and silently.
   - Interrogate a captured henchman for valuable information on Petrovsky's plans and the location of the weapon.

3. Decoding Complex Puzzles:
   - Encounter a series of intricate puzzles designed to protect Petrovsky's most classified research.
   - Use your analytical skills and attention to detail to decipher codes, manipulate hidden switches, and unlock doors to progress deeper into the fortress.
   - Beware of time-sensitive puzzles that require quick thinking to prevent triggering alarm systems.

4. The Showdown with Dr. Ivan Petrovsky:
   - Navigate through the heart of the fortress, braving flamethrower traps and laser barriers.
   - Confront Petrovsky in his elaborately designed laboratory, where the countdown to the weapon's activation has already begun.
   - Engage in a battle of wits and physical prowess as you attempt to disarm the weapon and apprehend Petrovsky before it's too late.

As Agent X, it is crucial to remain focused, adaptable, and willing to make difficult choices to ensure the success of your mission. The fate of the world rests in your hands. Now, go forth and embark on this high-stakes adventure to thwart Dr. Ivan Petrovsky's sinister plans!",0,0,201.15389204025269,22512,1854
64,4,"Certainly! In this captivating role play scenario, you will become Agent X, a highly skilled covert operative working for a clandestine government agency known as The Nexus. The Nexus specializes in handling extraterrestrial encounters and securing advanced alien technology for the benefit of national security.

Your mission, should you choose to accept it, is to investigate a recent UFO sighting in a remote area of the Nevada desert. Reports suggest that an alien spacecraft has crash-landed, and your objective is to locate the wreckage, gather intel on the alien occupants, and retrieve any valuable technology that may have survived the crash.

As Agent X, you possess exceptional training in combat, espionage, and technological expertise. You are resourceful, adaptable, and willing to go to great lengths to fulfill your mission. Engage in the following phases of your extraterrestrial investigation:

1. Infiltration: Begin by describing your approach to reaching the crash site undetected. Discuss your use of cutting-edge stealth technology, camouflage techniques, and your ability to outsmart any potential human or alien defenses in the area.

2. Examination: Once you reach the wreckage, delve into a meticulous analysis of the alien spacecraft. Share your observations on its design, propulsion systems, and any intriguing features that may hint at revolutionary advancements. Consider the potential military applications of such technology.

3. Interaction: As you explore the crash site, you come across a surviving alien being. Describe your initial encounter and establish communication with the extraterrestrial entity. Discuss your use of specialized translation devices or language experts from The Nexus to facilitate the conversation.

4. Negotiation: Engage in a high-stakes negotiation with the alien being. Express The Nexus' desire to establish a diplomatic relationship and exchange knowledge and technology between Earth and its civilization. Explore the potential mutual benefits, whether it be in the fields of medicine, energy, or scientific advancements.

Throughout the role play, embody the tenacity and secrecy of Agent X. Your focus is solely on fulfilling the objectives set forth by The Nexus, even if it means navigating complex interstellar politics or making difficult choices. Unravel the mysteries of the Nevada desert crash and demonstrate why you are the agency's most trusted operative when it comes to extraterrestrial encounters.",0,0,243.72015595436096,27365,2192
